School Safety & Security,Security Policies & Measures,"Promotes security awareness and vigilance amongst staff and students

Ensures the appropriate security procedures and measures are developed, established and in place/ready for implementation when required

Promotes partnership with police/SCDF units in the neighbourhood and engagement with the community (e.g. grassroots organisation), for collaboration and coordination in security vigilance and response

Stays updated with emerging security issues (e.g. terrorist attacks) and best practices to anticipate potential issues and implement preventive measures
","Demonstrates awareness of security policies and measures in school

Obtains fund to support the implementation of security measures in school
","Ensures school security for the school premises, property and school population; assists the Chief Safety Officer in ensuring the schools' emergency preparedness in the event of a security incident

Enforces appropriate security procedures and measures (e.g. conducts security checks, monitors the movement of visitors and contractors in school, daily access control and vehicle traffic) as part of ensuring school security

Acts as the school's representative to work with police/ SCDF and security service providers on security matters related to the school

Manages security systems and operation checks with security agencies (e.g. Ademco, Prowler Security, SPF)
",Not Applicable,Not Applicable,Not Applicable,"Enforces appropriate security procedures and measures to maintain the required level of security in the workshops

Ensures that the workshops are properly locked when no teacher or EWI are present, and that there is no entry of unauthorised personnel

For Senior STEM Workshop Instructors:
Reviews?and proposes improvements to safety processes for own areas of work
","Ensures that lab security measures are taken (e.g. dangerous materials are accounted for, properly labelled and kept under lock and key)

For Senior STEM Lab Instructors:
Reviews?and proposes improvements to safety processes for own areas of work
","Demonstrates awareness of security policies and measures in school and understands one's own role to support the enforcement of such measures
","Demonstrates awareness of security policies and measures in school and understands one's own role to support the enforcement of such measures
","Demonstrates awareness of security policies and measures in school and understands one's own role to support the enforcement of such measures
","Supports the OM in processes to safeguard the security of the school, such as arming and disarming of school security systems as required

Assists in ensuring school security by actively looking out for strangers and possible security threats; reports any security concerns immediately
"
